{
  "$schema": "http://json-schema.org/draft-07/schema#",
  "$id": "https://github.com/mcp-tool-shop-org/prototypes/schemas/passport.schema.json",
  "title": "Seed Passport",
  "description": "Per-seed metadata for the mcp-tool-shop-org/prototypes vault. Composes CodeMeta 3.0 core, RO-Crate 1.1 profile, MCPD-style facets, and ingest provenance.",
  "type": "object",
  "additionalProperties": false,
  "required": [
    "conformsTo",
    "id",
    "name",
    "title",
    "description",
    "version",
    "license",
    "datePublished",
    "dateModified",
    "codeRepository",
    "author",
    "keywords",
    "lifecycle",
    "taxonomy",
    "technical",
    "health",
    "lineage",
    "sbom",
    "discovery",
    "patterns",
    "failureModes",
    "priorArt",
    "agentCapsule",
    "ingest"
  ],
  "properties": {
    "$schema": { "type": "string" },
    "conformsTo": {
      "type": "array",
      "items": { "type": "string" },
      "minItems": 1,
      "description": "List of specifications this passport claims to conform to."
    },
    "id": {
      "type": "string",
      "pattern": "^seed:[a-zA-Z0-9][a-zA-Z0-9._-]*:[0-9]+\\.[0-9]+\\.[0-9]+(-[a-zA-Z0-9.-]+)?$",
      "description": "namespace:slug:version composite identifier."
    },
    "swhid": {
      "type": ["string", "null"],
      "pattern": "^swh:1:(cnt|dir|rev|rel|snp):[0-9a-f]{40}$",
      "description": "Software Heritage persistent identifier. Null until resolved."
    },
    "name": {
      "type": "string",
      "pattern": "^[a-zA-Z0-9][a-zA-Z0-9._-]*$",
      "description": "Slug. MUST equal the containing folder name."
    },
    "title": { "type": "string", "minLength": 1, "maxLength": 120 },
    "description": { "type": "string", "minLength": 30, "maxLength": 800 },
    "version": {
      "type": "string",
      "pattern": "^[0-9]+\\.[0-9]+\\.[0-9]+(-[a-zA-Z0-9.-]+)?$"
    },
    "license": {
      "type": "string",
      "description": "SPDX license identifier, or 'UNLICENSED'."
    },
    "datePublished": { "type": "string", "format": "date" },
    "dateModified": { "type": "string", "format": "date" },
    "codeRepository": { "type": "string", "format": "uri" },
    "author": {
      "type": "array",
      "minItems": 1,
      "items": {
        "type": "object",
        "additionalProperties": false,
        "required": ["name"],
        "properties": {
          "name": { "type": "string", "minLength": 1 },
          "email": { "type": "string", "format": "email" },
          "url": { "type": "string", "format": "uri" }
        }
      }
    },
    "keywords": {
      "type": "array",
      "items": { "type": "string", "minLength": 1, "maxLength": 40 },
      "maxItems": 20
    },
    "lifecycle": {
      "type": "object",
      "additionalProperties": false,
      "required": ["state", "stateSince", "maturity"],
      "properties": {
        "state": {
          "type": "string",
          "enum": ["sapling", "active", "dormant", "resurrection_candidate", "graduated", "archived"]
        },
        "stateSince": { "type": "string", "format": "date" },
        "maturity": {
          "type": "string",
          "enum": ["prototype", "alpha", "beta", "stable"]
        },
        "caretaker": { "type": ["string", "null"] },
        "graduatedTo": { "type": ["string", "null"], "format": "uri" },
        "resurrectionNotes": { "type": ["string", "null"] }
      }
    },
    "taxonomy": {
      "type": "object",
      "additionalProperties": false,
      "required": ["category", "tags"],
      "properties": {
        "category": { "type": "string" },
        "domains": { "type": "array", "items": { "type": "string" }, "maxItems": 10 },
        "tags": { "type": "array", "items": { "type": "string" }, "maxItems": 15 }
      }
    },
    "technical": {
      "type": "object",
      "additionalProperties": false,
      "required": ["kind", "programmingLanguages"],
      "properties": {
        "kind": {
          "type": "string",
          "enum": ["cli", "library", "mcp-server", "desktop", "vscode", "plugin", "service", "dataset", "extension"]
        },
        "programmingLanguages": {
          "type": "array",
          "minItems": 1,
          "items": { "type": "string" }
        },
        "runtimes": { "type": "array", "items": { "type": "string" } },
        "operatingSystems": {
          "type": "array",
          "items": { "type": "string", "enum": ["linux", "darwin", "win32", "any"] }
        }
      }
    },
    "health": {
      "type": "object",
      "additionalProperties": false,
      "description": "Auto-computed signals from git + filesystem. Do not hand-edit — seed:index overwrites.",
      "properties": {
        "lineCount": { "type": ["integer", "null"], "minimum": 0 },
        "lastCommitAt": { "type": ["string", "null"], "format": "date-time" },
        "commitRecencyDays": { "type": ["integer", "null"], "minimum": 0 },
        "hasTests": { "type": ["boolean", "null"] },
        "hasReadme": { "type": ["boolean", "null"] },
        "hasLicense": { "type": ["boolean", "null"] },
        "buildable": { "type": ["boolean", "null"], "description": "null = unknown; true = verified builds; false = known broken." }
      }
    },
    "lineage": {
      "type": "object",
      "additionalProperties": false,
      "properties": {
        "sourceRepo": { "type": ["string", "null"], "format": "uri" },
        "consolidatedAt": { "type": ["string", "null"], "format": "date" },
        "relatedSeeds": { "type": "array", "items": { "type": "string" } },
        "deprecates": { "type": "array", "items": { "type": "string" } },
        "successors": { "type": "array", "items": { "type": "string" } }
      }
    },
    "sbom": {
      "type": "object",
      "additionalProperties": false,
      "required": ["format"],
      "properties": {
        "format": { "type": "string", "enum": ["cyclonedx", "spdx", "none"] },
        "url": { "type": ["string", "null"] },
        "hash": { "type": ["string", "null"], "pattern": "^sha256:[0-9a-f]{64}$" }
      }
    },
    "discovery": {
      "type": "object",
      "additionalProperties": false,
      "required": ["oneLiner"],
      "properties": {
        "oneLiner": { "type": "string", "minLength": 1, "maxLength": 200 },
        "whyItMatters": { "type": ["string", "null"], "maxLength": 500 }
      }
    },
    "patterns": {
      "type": "array",
      "description": "Structured patterns this seed proved or demonstrated. Queryable across the vault.",
      "maxItems": 12,
      "items": {
        "type": "object",
        "additionalProperties": false,
        "required": ["name", "category", "summary"],
        "properties": {
          "name": { "type": "string", "minLength": 3, "maxLength": 80 },
          "category": { "type": "string", "description": "Must be in taxonomy.json:patternCategories." },
          "summary": { "type": "string", "minLength": 10, "maxLength": 280 }
        }
      }
    },
    "failureModes": {
      "type": "array",
      "description": "Things tried that didn't work. Negative knowledge is payload.",
      "maxItems": 10,
      "items": {
        "type": "object",
        "additionalProperties": false,
        "required": ["tried", "didntWorkBecause"],
        "properties": {
          "tried": { "type": "string", "minLength": 5, "maxLength": 200 },
          "didntWorkBecause": { "type": "string", "minLength": 5, "maxLength": 280 },
          "pivoted": { "type": ["string", "null"], "maxLength": 200 }
        }
      }
    },
    "priorArt": {
      "type": "array",
      "description": "Papers, blog posts, or prior tools that inspired this seed.",
      "maxItems": 10,
      "items": {
        "type": "object",
        "additionalProperties": false,
        "required": ["url"],
        "properties": {
          "url": { "type": "string", "format": "uri" },
          "title": { "type": ["string", "null"], "maxLength": 200 },
          "kind": {
            "type": ["string", "null"],
            "enum": ["paper", "blog", "tool", "video", "talk", "rfc", "spec", "other", null]
          }
        }
      }
    },
    "agentCapsule": {
      "type": "object",
      "additionalProperties": false,
      "description": "Minimum payload for an LLM agent to grasp the core trick in seconds.",
      "properties": {
        "insight": { "type": ["string", "null"], "minLength": 10, "maxLength": 200 },
        "excerpt": { "type": ["string", "null"], "maxLength": 400, "description": "Tiny code snippet illustrating the trick. Keep under 400 chars." }
      }
    },
    "ingest": {
      "type": "object",
      "additionalProperties": false,
      "required": ["method", "confidence", "manualReview", "ingestedAt"],
      "properties": {
        "method": {
          "type": "string",
          "enum": ["manual", "generator", "ollama-backfill"]
        },
        "model": { "type": ["string", "null"] },
        "confidence": { "type": "number", "minimum": 0, "maximum": 1 },
        "manualReview": { "type": "boolean" },
        "ingestedAt": { "type": "string", "format": "date-time" }
      }
    }
  }
}
