{
  "$schema": "../../schemas/passport.schema.json",
  "conformsTo": [
    "codemeta:3.0",
    "ro-crate:1.1",
    "mcp-prototypes:passport:1"
  ],
  "id": "seed:jam-session-plugin:0.1.0",
  "swhid": null,
  "name": "jam-session-plugin",
  "title": "AI Jam Session",
  "description": "A Claude Code plugin with a 100-song library, structured lessons, and AI jam sessions — plays through your system audio, no external software required.",
  "version": "0.1.0",
  "license": "MIT",
  "datePublished": "2026-04-20",
  "dateModified": "2026-04-20",
  "codeRepository": "https://github.com/mcp-tool-shop-org/prototypes/tree/main/packages/jam-session-plugin",
  "author": [
    {
      "name": "mcp-tool-shop"
    }
  ],
  "keywords": [],
  "lifecycle": {
    "state": "dormant",
    "stateSince": "2026-04-08",
    "maturity": "prototype",
    "caretaker": null,
    "graduatedTo": null,
    "resurrectionNotes": null
  },
  "taxonomy": {
    "category": "developer-tools",
    "domains": [],
    "tags": [
      "typescript",
      "javascript",
      "cli",
      "mcp",
      "plugin"
    ]
  },
  "technical": {
    "kind": "plugin",
    "programmingLanguages": [
      "TypeScript",
      "JavaScript"
    ],
    "runtimes": [],
    "operatingSystems": [
      "any"
    ]
  },
  "health": {
    "lineCount": null,
    "lastCommitAt": null,
    "commitRecencyDays": null,
    "hasTests": null,
    "hasReadme": null,
    "hasLicense": null,
    "buildable": null
  },
  "lineage": {
    "sourceRepo": null,
    "consolidatedAt": "2026-04-08",
    "relatedSeeds": [],
    "deprecates": [],
    "successors": []
  },
  "sbom": {
    "format": "none",
    "url": null,
    "hash": null
  },
  "discovery": {
    "oneLiner": "A plugin for the Claude Code environment that provides AI-assisted piano lessons and jam sessions.",
    "whyItMatters": "This plugin demonstrates an innovative use of AI to teach and facilitate musical creativity in a user-friendly way within the Claude Code ecosystem."
  },
  "patterns": [
    {
      "name": "agent-workflow",
      "category": "concurrency",
      "summary": "The plugin uses agents with distinct personalities to guide users through teaching sessions and jam sessions, demonstrating an advanced level of concurrency in handling user interactions."
    }
  ],
  "failureModes": [],
  "priorArt": [],
  "agentCapsule": {
    "insight": null,
    "excerpt": null
  },
  "ingest": {
    "method": "ollama-backfill",
    "model": "hermes3:8b",
    "confidence": 0.9,
    "manualReview": true,
    "ingestedAt": "2026-04-20T21:53:41.130Z"
  }
}
