{
  "$schema": "../../schemas/passport.schema.json",
  "conformsTo": [
    "codemeta:3.0",
    "ro-crate:1.1",
    "mcp-prototypes:passport:1"
  ],
  "id": "seed:DeterministicMouseTrainingEngine:0.1.0",
  "swhid": null,
  "name": "DeterministicMouseTrainingEngine",
  "title": "DeterministicMouseTrainingEngine",
  "description": "A .NET MAUI desktop app for deterministic mouse training with composable game modes and blueprint mutators.",
  "version": "0.1.0",
  "license": "MIT",
  "datePublished": "2026-04-20",
  "dateModified": "2026-04-20",
  "codeRepository": "https://github.com/mcp-tool-shop-org/prototypes/tree/main/packages/DeterministicMouseTrainingEngine",
  "author": [
    {
      "name": "mcp-tool-shop"
    }
  ],
  "keywords": [],
  "lifecycle": {
    "state": "dormant",
    "stateSince": "2026-04-08",
    "maturity": "prototype",
    "caretaker": null,
    "graduatedTo": null,
    "resurrectionNotes": null
  },
  "taxonomy": {
    "category": "desktop-apps",
    "domains": [],
    "tags": [
      "typescript",
      "csharp",
      "maui",
      "cli",
      "mcp"
    ]
  },
  "technical": {
    "kind": "desktop",
    "programmingLanguages": [
      "TypeScript",
      "C#"
    ],
    "runtimes": [],
    "operatingSystems": [
      "any"
    ]
  },
  "health": {
    "lineCount": null,
    "lastCommitAt": null,
    "commitRecencyDays": null,
    "hasTests": null,
    "hasReadme": null,
    "hasLicense": null,
    "buildable": null
  },
  "lineage": {
    "sourceRepo": null,
    "consolidatedAt": "2026-04-08",
    "relatedSeeds": [],
    "deprecates": [],
    "successors": []
  },
  "sbom": {
    "format": "none",
    "url": null,
    "hash": null
  },
  "discovery": {
    "oneLiner": "Deterministic mouse training engine with fixed-timestep simulation, composable game modes and blueprint mutators.",
    "whyItMatters": "Provides a structured framework for deterministic mouse training with built-in replay verification and reproducible audio cues."
  },
  "patterns": [
    {
      "name": "composable-game-modes",
      "category": "data-model",
      "summary": "Supports pluggable game modes via an IGameSimulation interface, allowing for easy composition of different training scenarios."
    }
  ],
  "failureModes": [],
  "priorArt": [],
  "agentCapsule": {
    "insight": null,
    "excerpt": null
  },
  "ingest": {
    "method": "ollama-backfill",
    "model": "hermes3:8b",
    "confidence": 0.9,
    "manualReview": true,
    "ingestedAt": "2026-04-20T21:48:47.611Z"
  }
}
