{
  "$schema": "../../schemas/passport.schema.json",
  "conformsTo": [
    "codemeta:3.0",
    "ro-crate:1.1",
    "mcp-prototypes:passport:1"
  ],
  "id": "seed:claude-memories:1.0.3",
  "swhid": null,
  "name": "claude-memories",
  "title": "claude-memories",
  "description": "MEMORY.md optimizer and dispatch table generator for Claude Code",
  "version": "1.0.3",
  "license": "MIT",
  "datePublished": "2026-04-20",
  "dateModified": "2026-04-20",
  "codeRepository": "https://github.com/mcp-tool-shop-org/prototypes/tree/main/packages/claude-memories",
  "author": [
    {
      "name": "mcp-tool-shop"
    }
  ],
  "keywords": [],
  "lifecycle": {
    "state": "dormant",
    "stateSince": "2026-04-08",
    "maturity": "prototype",
    "caretaker": null,
    "graduatedTo": null,
    "resurrectionNotes": null
  },
  "taxonomy": {
    "category": "developer-tools",
    "domains": [],
    "tags": [
      "typescript",
      "javascript",
      "cli",
      "mcp"
    ]
  },
  "technical": {
    "kind": "cli",
    "programmingLanguages": [
      "typescript",
      "javascript"
    ],
    "runtimes": [],
    "operatingSystems": [
      "any"
    ]
  },
  "health": {
    "lineCount": null,
    "lastCommitAt": null,
    "commitRecencyDays": null,
    "hasTests": null,
    "hasReadme": null,
    "hasLicense": null,
    "buildable": null
  },
  "lineage": {
    "sourceRepo": null,
    "consolidatedAt": "2026-04-08",
    "relatedSeeds": [],
    "deprecates": [],
    "successors": []
  },
  "sbom": {
    "format": "none",
    "url": null,
    "hash": null
  },
  "discovery": {
    "oneLiner": "MEMORY.md optimizer and dispatch-table generator for Claude Code.",
    "whyItMatters": "This tool optimizes MEMORY.md files for Claude Code, reducing memory overhead and improving performance by generating a dispatch table that allows agents to load only relevant memories on-demand."
  },
  "patterns": [],
  "failureModes": [],
  "priorArt": [],
  "agentCapsule": {
    "insight": null,
    "excerpt": null
  },
  "ingest": {
    "method": "ollama-backfill",
    "model": "hermes3:8b",
    "confidence": 1,
    "manualReview": true,
    "ingestedAt": "2026-04-20T22:06:33.444Z"
  }
}
