{
  "$schema": "../../schemas/passport.schema.json",
  "conformsTo": [
    "codemeta:3.0",
    "ro-crate:1.1",
    "mcp-prototypes:passport:1"
  ],
  "id": "seed:ToolShopStudio:1.7.0",
  "swhid": null,
  "name": "ToolShopStudio",
  "title": "ToolShopStudio",
  "description": "Six MCP tools + live Registry (FFmpeg, Pandoc, FreeCAD, GDAL, OpenSCAD, Blender) — schema-first, sandboxed, observable",
  "version": "1.7.0",
  "license": "MIT",
  "datePublished": "2026-04-20",
  "dateModified": "2026-04-20",
  "codeRepository": "https://github.com/mcp-tool-shop-org/prototypes/tree/main/packages/ToolShopStudio",
  "author": [
    {
      "name": "mcp-tool-shop"
    }
  ],
  "keywords": [],
  "lifecycle": {
    "state": "dormant",
    "stateSince": "2026-04-08",
    "maturity": "prototype",
    "caretaker": null,
    "graduatedTo": null,
    "resurrectionNotes": null
  },
  "taxonomy": {
    "category": "developer-tools",
    "domains": [],
    "tags": [
      "typescript",
      "javascript",
      "cli",
      "mcp",
      "registry"
    ]
  },
  "technical": {
    "kind": "library",
    "programmingLanguages": [
      "TypeScript",
      "JavaScript"
    ],
    "runtimes": [],
    "operatingSystems": [
      "any"
    ]
  },
  "health": {
    "lineCount": null,
    "lastCommitAt": null,
    "commitRecencyDays": null,
    "hasTests": null,
    "hasReadme": null,
    "hasLicense": null,
    "buildable": null
  },
  "lineage": {
    "sourceRepo": null,
    "consolidatedAt": "2026-04-08",
    "relatedSeeds": [],
    "deprecates": [],
    "successors": []
  },
  "sbom": {
    "format": "none",
    "url": null,
    "hash": null
  },
  "discovery": {
    "oneLiner": "Six schema-first, sandboxed tools for media processing and document conversion.",
    "whyItMatters": "Provides a unified API to several powerful command-line tools for common tasks like video transcoding, document conversion, 3D modeling, GIS processing, and more. The live Registry adds auto-generated documentation and search capabilities."
  },
  "patterns": [
    {
      "name": "concurrency",
      "category": "data-model",
      "summary": "Uses async I/O for tool execution with progress reporting."
    }
  ],
  "failureModes": [],
  "priorArt": [],
  "agentCapsule": {
    "insight": null,
    "excerpt": null
  },
  "ingest": {
    "method": "ollama-backfill",
    "model": "hermes3:8b",
    "confidence": 0.9,
    "manualReview": false,
    "ingestedAt": "2026-04-20T22:05:35.558Z"
  }
}
