{
  "$schema": "../../schemas/passport.schema.json",
  "conformsTo": [
    "codemeta:3.0",
    "ro-crate:1.1",
    "mcp-prototypes:passport:1"
  ],
  "id": "seed:mcp-examples:0.1.0",
  "swhid": null,
  "name": "mcp-examples",
  "title": "mcp-examples",
  "description": "Example workspaces for [MCP Tool Shop](https://github.com/mcp-tool-shop-org).",
  "version": "0.1.0",
  "license": "MIT",
  "datePublished": "2026-04-20",
  "dateModified": "2026-04-20",
  "codeRepository": "https://github.com/mcp-tool-shop-org/prototypes/tree/main/packages/mcp-examples",
  "author": [
    {
      "name": "mcp-tool-shop"
    }
  ],
  "keywords": [],
  "lifecycle": {
    "state": "dormant",
    "stateSince": "2026-04-08",
    "maturity": "prototype",
    "caretaker": null,
    "graduatedTo": null,
    "resurrectionNotes": null
  },
  "taxonomy": {
    "category": "developer-tools",
    "domains": [],
    "tags": [
      "python"
    ]
  },
  "technical": {
    "kind": "cli",
    "programmingLanguages": [
      "Python"
    ],
    "runtimes": [],
    "operatingSystems": [
      "any"
    ]
  },
  "health": {
    "lineCount": null,
    "lastCommitAt": null,
    "commitRecencyDays": null,
    "hasTests": null,
    "hasReadme": null,
    "hasLicense": null,
    "buildable": null
  },
  "lineage": {
    "sourceRepo": null,
    "consolidatedAt": "2026-04-08",
    "relatedSeeds": [],
    "deprecates": [],
    "successors": []
  },
  "sbom": {
    "format": "none",
    "url": null,
    "hash": null
  },
  "discovery": {
    "oneLiner": "Example workspaces for [MCP Tool Shop](https://github.com/mcp-tool-shop-org).",
    "whyItMatters": "Provides example usage of MCP tools and demonstrates safe, opt-in access to the filesystem and network."
  },
  "patterns": [],
  "failureModes": [],
  "priorArt": [],
  "agentCapsule": {
    "insight": null,
    "excerpt": null
  },
  "ingest": {
    "method": "ollama-backfill",
    "model": "hermes3:8b",
    "confidence": 0.7,
    "manualReview": true,
    "ingestedAt": "2026-04-20T21:54:36.604Z"
  }
}
