{
  "$schema": "../../schemas/passport.schema.json",
  "conformsTo": [
    "codemeta:3.0",
    "ro-crate:1.1",
    "mcp-prototypes:passport:1"
  ],
  "id": "seed:claude-hook-debug:1.0.3",
  "swhid": null,
  "name": "claude-hook-debug",
  "title": "claude-hook-debug",
  "description": "Diagnostic CLI for Claude Code hook issues — detects ghost hooks, scope conflicts, and plugin lifecycle bugs",
  "version": "1.0.3",
  "license": "MIT",
  "datePublished": "2026-04-20",
  "dateModified": "2026-04-20",
  "codeRepository": "https://github.com/mcp-tool-shop-org/prototypes/tree/main/packages/claude-hook-debug",
  "author": [
    {
      "name": "mcp-tool-shop"
    }
  ],
  "keywords": [],
  "lifecycle": {
    "state": "dormant",
    "stateSince": "2026-04-08",
    "maturity": "prototype",
    "caretaker": null,
    "graduatedTo": null,
    "resurrectionNotes": null
  },
  "taxonomy": {
    "category": "developer-tools",
    "domains": [],
    "tags": [
      "typescript",
      "javascript",
      "cli",
      "mcp"
    ]
  },
  "technical": {
    "kind": "cli",
    "programmingLanguages": [
      "TypeScript",
      "JavaScript"
    ],
    "runtimes": [],
    "operatingSystems": [
      "any"
    ]
  },
  "health": {
    "lineCount": null,
    "lastCommitAt": null,
    "commitRecencyDays": null,
    "hasTests": null,
    "hasReadme": null,
    "hasLicense": null,
    "buildable": null
  },
  "lineage": {
    "sourceRepo": null,
    "consolidatedAt": "2026-04-08",
    "relatedSeeds": [],
    "deprecates": [],
    "successors": []
  },
  "sbom": {
    "format": "none",
    "url": null,
    "hash": null
  },
  "discovery": {
    "oneLiner": "Diagnostic CLI for detecting issues in Claude Code hooks and plugins.",
    "whyItMatters": "Helps developers identify and fix problems with their Claude Code settings and plugin configurations, improving the reliability of their projects."
  },
  "patterns": [],
  "failureModes": [],
  "priorArt": [],
  "agentCapsule": {
    "insight": null,
    "excerpt": null
  },
  "ingest": {
    "method": "ollama-backfill",
    "model": "hermes3:8b",
    "confidence": 1,
    "manualReview": false,
    "ingestedAt": "2026-04-20T21:50:59.753Z"
  }
}
