{
  "$schema": "../../schemas/passport.schema.json",
  "conformsTo": [
    "codemeta:3.0",
    "ro-crate:1.1",
    "mcp-prototypes:passport:1"
  ],
  "id": "seed:dev-op-typer:0.1.0",
  "swhid": null,
  "name": "dev-op-typer",
  "title": "dev-op-typer",
  "description": "A developer-focused typing practice app for Windows — every test is real code.",
  "version": "0.1.0",
  "license": "MIT",
  "datePublished": "2026-04-20",
  "dateModified": "2026-04-20",
  "codeRepository": "https://github.com/mcp-tool-shop-org/prototypes/tree/main/packages/dev-op-typer",
  "author": [
    {
      "name": "mcp-tool-shop"
    }
  ],
  "keywords": [],
  "lifecycle": {
    "state": "dormant",
    "stateSince": "2026-04-08",
    "maturity": "prototype",
    "caretaker": null,
    "graduatedTo": null,
    "resurrectionNotes": null
  },
  "taxonomy": {
    "category": "typing-and-input",
    "domains": [],
    "tags": [
      "csharp"
    ]
  },
  "technical": {
    "kind": "desktop",
    "programmingLanguages": [
      "C#",
      "XAML",
      "TypeScript"
    ],
    "runtimes": [],
    "operatingSystems": [
      "any"
    ]
  },
  "health": {
    "lineCount": null,
    "lastCommitAt": null,
    "commitRecencyDays": null,
    "hasTests": null,
    "hasReadme": null,
    "hasLicense": null,
    "buildable": null
  },
  "lineage": {
    "sourceRepo": null,
    "consolidatedAt": "2026-04-08",
    "relatedSeeds": [],
    "deprecates": [],
    "successors": []
  },
  "sbom": {
    "format": "none",
    "url": null,
    "hash": null
  },
  "discovery": {
    "oneLiner": "A typing practice app that uses real code snippets from six languages.",
    "whyItMatters": "Helps developers improve their coding speed and accuracy using actual programming examples."
  },
  "patterns": [],
  "failureModes": [],
  "priorArt": [],
  "agentCapsule": {
    "insight": null,
    "excerpt": null
  },
  "ingest": {
    "method": "ollama-backfill",
    "model": "hermes3:8b",
    "confidence": 0.9,
    "manualReview": false,
    "ingestedAt": "2026-04-20T21:52:46.672Z"
  }
}
