{
  "$schema": "../../schemas/passport.schema.json",
  "conformsTo": [
    "codemeta:3.0",
    "ro-crate:1.1",
    "mcp-prototypes:passport:1"
  ],
  "id": "seed:claude-rules:1.2.2",
  "swhid": null,
  "name": "claude-rules",
  "title": "claude-rules",
  "description": "A tool for optimizing and splitting CLAUDE.md files into lean indexes + core rules.",
  "version": "1.2.2",
  "license": "MIT",
  "datePublished": "2026-04-20",
  "dateModified": "2026-04-20",
  "codeRepository": "https://github.com/mcp-tool-shop-org/prototypes/tree/main/packages/claude-rules",
  "author": [
    {
      "name": "mcp-tool-shop"
    }
  ],
  "keywords": [
    "documentation",
    "optimization",
    "splitting",
    "indexing"
  ],
  "lifecycle": {
    "state": "dormant",
    "stateSince": "2026-04-08",
    "maturity": "prototype",
    "caretaker": null,
    "graduatedTo": null,
    "resurrectionNotes": null
  },
  "taxonomy": {
    "category": "developer-tools",
    "domains": [],
    "tags": [
      "typescript",
      "javascript",
      "cli",
      "mcp"
    ]
  },
  "technical": {
    "kind": "cli",
    "programmingLanguages": [
      "typescript",
      "javascript"
    ],
    "runtimes": [],
    "operatingSystems": [
      "any"
    ]
  },
  "health": {
    "lineCount": null,
    "lastCommitAt": null,
    "commitRecencyDays": null,
    "hasTests": null,
    "hasReadme": null,
    "hasLicense": null,
    "buildable": null
  },
  "lineage": {
    "sourceRepo": null,
    "consolidatedAt": "2026-04-08",
    "relatedSeeds": [],
    "deprecates": [],
    "successors": []
  },
  "sbom": {
    "format": "none",
    "url": null,
    "hash": null
  },
  "discovery": {
    "oneLiner": "true, // This tool can be used to optimize a CLAUDE.md file in one command.",
    "whyItMatters": "By splitting CLAUDE.md into lean indexes + core rules, this tool helps maintain large documentation projects by reducing the cognitive load of reading through all details on every use."
  },
  "patterns": [
    {
      "name": "agent-workflow",
      "category": "data-model",
      "summary": "The tool uses a CLI interface to accept input and produce output, following standard conventions for command-line tools."
    }
  ],
  "failureModes": [],
  "priorArt": [],
  "agentCapsule": {
    "insight": null,
    "excerpt": null
  },
  "ingest": {
    "method": "ollama-backfill",
    "model": "hermes3:8b",
    "confidence": 0.9,
    "manualReview": true,
    "ingestedAt": "2026-04-20T21:51:13.445Z"
  }
}
