{
  "$schema": "../../schemas/passport.schema.json",
  "conformsTo": [
    "codemeta:3.0",
    "ro-crate:1.1",
    "mcp-prototypes:passport:1"
  ],
  "id": "seed:rippled-windows-debug:0.1.0",
  "swhid": null,
  "name": "rippled-windows-debug",
  "title": "rippled-windows-debug",
  "description": "Windows debugging toolkit for rippled (XRPL validator node). Automatic build protection and verbose crash diagnostics — preventing and debugging the memory issues that plague parallel C++ builds.",
  "version": "0.1.0",
  "license": "MIT",
  "datePublished": "2026-04-20",
  "dateModified": "2026-04-20",
  "codeRepository": "https://github.com/mcp-tool-shop-org/prototypes/tree/main/packages/rippled-windows-debug",
  "author": [
    {
      "name": "mcp-tool-shop"
    }
  ],
  "keywords": [],
  "lifecycle": {
    "state": "dormant",
    "stateSince": "2026-04-08",
    "maturity": "prototype",
    "caretaker": null,
    "graduatedTo": null,
    "resurrectionNotes": null
  },
  "taxonomy": {
    "category": "developer-tools",
    "domains": [],
    "tags": [
      "typescript",
      "javascript",
      "cli",
      "mcp",
      "observability",
      "testing"
    ]
  },
  "technical": {
    "kind": "cli",
    "programmingLanguages": [
      "TypeScript",
      "JavaScript"
    ],
    "runtimes": [],
    "operatingSystems": [
      "any"
    ]
  },
  "health": {
    "lineCount": null,
    "lastCommitAt": null,
    "commitRecencyDays": null,
    "hasTests": null,
    "hasReadme": null,
    "hasLicense": null,
    "buildable": null
  },
  "lineage": {
    "sourceRepo": null,
    "consolidatedAt": "2026-04-08",
    "relatedSeeds": [],
    "deprecates": [],
    "successors": []
  },
  "sbom": {
    "format": "none",
    "url": null,
    "hash": null
  },
  "discovery": {
    "oneLiner": "Windows debugging toolkit for rippled (XRPL validator node). Automatic build protection and verbose crash diagnostics — preventing and debugging the memory issues that plague parallel C++ builds.",
    "whyItMatters": "Prevents and diagnoses crashes in complex C++ builds, which is a common problem in software development."
  },
  "patterns": [
    {
      "name": "observability",
      "category": "caching",
      "summary": "The toolkit provides verbose crash handlers that capture detailed information about crashes, including the actual exception type and message, full stack trace with symbol resolution, signal information, and build and system info."
    }
  ],
  "failureModes": [],
  "priorArt": [],
  "agentCapsule": {
    "insight": null,
    "excerpt": null
  },
  "ingest": {
    "method": "ollama-backfill",
    "model": "hermes3:8b",
    "confidence": 0.9,
    "manualReview": false,
    "ingestedAt": "2026-04-20T21:57:41.404Z"
  }
}
