{
  "$schema": "../../schemas/passport.schema.json",
  "conformsTo": [
    "codemeta:3.0",
    "ro-crate:1.1",
    "mcp-prototypes:passport:1"
  ],
  "id": "seed:Trace:0.1.0",
  "swhid": null,
  "name": "Trace",
  "title": "Trace",
  "description": "Deterministic cursor discipline game — precision, control, and composure under chaos.",
  "version": "0.1.0",
  "license": "MIT",
  "datePublished": "2026-04-20",
  "dateModified": "2026-04-20",
  "codeRepository": "https://github.com/mcp-tool-shop-org/prototypes/tree/main/packages/Trace",
  "author": [
    {
      "name": "mcp-tool-shop"
    }
  ],
  "keywords": [],
  "lifecycle": {
    "state": "dormant",
    "stateSince": "2026-04-08",
    "maturity": "prototype",
    "caretaker": null,
    "graduatedTo": null,
    "resurrectionNotes": null
  },
  "taxonomy": {
    "category": "mouse-and-cursor",
    "domains": [],
    "tags": [
      "csharp"
    ]
  },
  "technical": {
    "kind": "desktop",
    "programmingLanguages": [
      "C#",
      "TypeScript",
      "XAML"
    ],
    "runtimes": [],
    "operatingSystems": [
      "any"
    ]
  },
  "health": {
    "lineCount": null,
    "lastCommitAt": null,
    "commitRecencyDays": null,
    "hasTests": null,
    "hasReadme": null,
    "hasLicense": null,
    "buildable": null
  },
  "lineage": {
    "sourceRepo": null,
    "consolidatedAt": "2026-04-08",
    "relatedSeeds": [],
    "deprecates": [],
    "successors": []
  },
  "sbom": {
    "format": "none",
    "url": null,
    "hash": null
  },
  "discovery": {
    "oneLiner": "Built on .NET 10 MAUI (Windows-first), with a fully deterministic fixed-timestep simulation, a five-state motion state machine, and a parametric visual identity driven entirely by simulation state.",
    "whyItMatters": "Trace is not an aim trainer. Trace is not an arcade game. Mastery looks calm."
  },
  "patterns": [
    {
      "name": "deterministic fixed-timestep simulation",
      "category": "rendering",
      "summary": "Uses a fixed timestep for its rendering, ensuring consistent performance and behavior across different devices."
    }
  ],
  "failureModes": [],
  "priorArt": [],
  "agentCapsule": {
    "insight": null,
    "excerpt": null
  },
  "ingest": {
    "method": "ollama-backfill",
    "model": "hermes3:8b",
    "confidence": 0.9,
    "manualReview": false,
    "ingestedAt": "2026-04-20T21:49:51.516Z"
  }
}
