{
  "$schema": "../../schemas/passport.schema.json",
  "conformsTo": [
    "codemeta:3.0",
    "ro-crate:1.1",
    "mcp-prototypes:passport:1"
  ],
  "id": "seed:headless-wheel-builder:0.1.0",
  "swhid": null,
  "name": "headless-wheel-builder",
  "title": "headless-wheel-builder",
  "description": "A universal, headless Python wheel builder with integrated GitHub operations, release management, and full CI/CD pipeline automation.",
  "version": "0.1.0",
  "license": "MIT",
  "datePublished": "2026-04-20",
  "dateModified": "2026-04-20",
  "codeRepository": "https://github.com/mcp-tool-shop-org/prototypes/tree/main/packages/headless-wheel-builder",
  "author": [
    {
      "name": "mcp-tool-shop"
    }
  ],
  "keywords": [],
  "lifecycle": {
    "state": "dormant",
    "stateSince": "2026-04-08",
    "maturity": "prototype",
    "caretaker": null,
    "graduatedTo": null,
    "resurrectionNotes": null
  },
  "taxonomy": {
    "category": "developer-tools",
    "domains": [],
    "tags": [
      "python",
      "cli",
      "mcp"
    ]
  },
  "technical": {
    "kind": "cli",
    "programmingLanguages": [
      "Python",
      "JavaScript/TypeScript (some subcommands)"
    ],
    "runtimes": [],
    "operatingSystems": [
      "any"
    ]
  },
  "health": {
    "lineCount": null,
    "lastCommitAt": null,
    "commitRecencyDays": null,
    "hasTests": null,
    "hasReadme": null,
    "hasLicense": null,
    "buildable": null
  },
  "lineage": {
    "sourceRepo": null,
    "consolidatedAt": "2026-04-08",
    "relatedSeeds": [],
    "deprecates": [],
    "successors": []
  },
  "sbom": {
    "format": "none",
    "url": null,
    "hash": null
  },
  "discovery": {
    "oneLiner": "true, but confidence is only 0.7 due to missing package.json and sparse README",
    "whyItMatters": "This tool automates many aspects of Python package distribution, including build, release management, dependency analysis, CI/CD pipeline orchestration, and GitHub integration."
  },
  "patterns": [],
  "failureModes": [],
  "priorArt": [],
  "agentCapsule": {
    "insight": null,
    "excerpt": null
  },
  "ingest": {
    "method": "ollama-backfill",
    "model": "hermes3:8b",
    "confidence": 0.7,
    "manualReview": true,
    "ingestedAt": "2026-04-20T21:53:27.811Z"
  }
}
