{
  "$schema": "../../schemas/passport.schema.json",
  "conformsTo": [
    "codemeta:3.0",
    "ro-crate:1.1",
    "mcp-prototypes:passport:1"
  ],
  "id": "seed:soundboard-maui:0.1.0",
  "swhid": null,
  "name": "soundboard-maui",
  "title": "soundboard-maui",
  "description": "Cross-platform .NET MAUI desktop client for the Sound Board voice engine.",
  "version": "0.1.0",
  "license": "MIT",
  "datePublished": "2026-04-20",
  "dateModified": "2026-04-20",
  "codeRepository": "https://github.com/mcp-tool-shop-org/prototypes/tree/main/packages/soundboard-maui",
  "author": [
    {
      "name": "mcp-tool-shop"
    }
  ],
  "keywords": [],
  "lifecycle": {
    "state": "dormant",
    "stateSince": "2026-04-08",
    "maturity": "prototype",
    "caretaker": null,
    "graduatedTo": null,
    "resurrectionNotes": null
  },
  "taxonomy": {
    "category": "voice-and-sound",
    "domains": [],
    "tags": [
      "csharp",
      "cli",
      "maui",
      "sdk"
    ]
  },
  "technical": {
    "kind": "desktop",
    "programmingLanguages": [
      "C#"
    ],
    "runtimes": [],
    "operatingSystems": [
      "any"
    ]
  },
  "health": {
    "lineCount": null,
    "lastCommitAt": null,
    "commitRecencyDays": null,
    "hasTests": null,
    "hasReadme": null,
    "hasLicense": null,
    "buildable": null
  },
  "lineage": {
    "sourceRepo": null,
    "consolidatedAt": "2026-04-08",
    "relatedSeeds": [],
    "deprecates": [],
    "successors": []
  },
  "sbom": {
    "format": "none",
    "url": null,
    "hash": null
  },
  "discovery": {
    "oneLiner": "A .NET MAUI desktop client for the Sound Board voice engine.",
    "whyItMatters": "Provides a cross-platform desktop interface to interact with the Sound Board TTS engine using the .NET MAUI framework."
  },
  "patterns": [],
  "failureModes": [],
  "priorArt": [],
  "agentCapsule": {
    "insight": null,
    "excerpt": null
  },
  "ingest": {
    "method": "ollama-backfill",
    "model": "hermes3:8b",
    "confidence": 1,
    "manualReview": false,
    "ingestedAt": "2026-04-20T21:58:20.337Z"
  }
}
