{
  "$schema": "../../schemas/passport.schema.json",
  "conformsTo": [
    "codemeta:3.0",
    "ro-crate:1.1",
    "mcp-prototypes:passport:1"
  ],
  "id": "seed:CursorAssist:0.1.0",
  "swhid": null,
  "name": "CursorAssist",
  "title": "CursorAssist",
  "description": "A deterministic engine for assistive cursor control, UI accessibility benchmarking, and adaptive motor-skill training.",
  "version": "0.1.0",
  "license": "MIT",
  "datePublished": "2026-04-20",
  "dateModified": "2026-04-20",
  "codeRepository": "https://github.com/mcp-tool-shop-org/prototypes/tree/main/packages/CursorAssist",
  "author": [
    {
      "name": "mcp-tool-shop"
    }
  ],
  "keywords": [],
  "lifecycle": {
    "state": "dormant",
    "stateSince": "2026-04-08",
    "maturity": "prototype",
    "caretaker": null,
    "graduatedTo": null,
    "resurrectionNotes": null
  },
  "taxonomy": {
    "category": "mouse-and-cursor",
    "domains": [],
    "tags": [
      "csharp",
      "cli",
      "mcp",
      "tauri",
      "winui3",
      "maui"
    ]
  },
  "technical": {
    "kind": "library",
    "programmingLanguages": [
      "C#"
    ],
    "runtimes": [],
    "operatingSystems": [
      "any"
    ]
  },
  "health": {
    "lineCount": null,
    "lastCommitAt": null,
    "commitRecencyDays": null,
    "hasTests": null,
    "hasReadme": null,
    "hasLicense": null,
    "buildable": null
  },
  "lineage": {
    "sourceRepo": null,
    "consolidatedAt": "2026-04-08",
    "relatedSeeds": [],
    "deprecates": [],
    "successors": []
  },
  "sbom": {
    "format": "none",
    "url": null,
    "hash": null
  },
  "discovery": {
    "oneLiner": "Deterministic assistive cursor control engine with NuGet packages for schemas, trace format, policy mapping, and transform pipeline.",
    "whyItMatters": "Provides a modular set of tools for building assistive technologies with reproducible and verifiable results."
  },
  "patterns": [
    {
      "name": "input-handling",
      "category": "signal-processing",
      "summary": "Velocity-adaptive EMA smoothing with phase correction, power-law frequency-weighted deadzones, and cosine coherence for directional intent detection."
    }
  ],
  "failureModes": [],
  "priorArt": [],
  "agentCapsule": {
    "insight": null,
    "excerpt": null
  },
  "ingest": {
    "method": "ollama-backfill",
    "model": "hermes3:8b",
    "confidence": 0.9,
    "manualReview": true,
    "ingestedAt": "2026-04-20T21:48:40.378Z"
  }
}
