{
  "$schema": "../../schemas/passport.schema.json",
  "conformsTo": [
    "codemeta:3.0",
    "ro-crate:1.1",
    "mcp-prototypes:passport:1"
  ],
  "id": "seed:aspire-ai:0.1.0",
  "swhid": null,
  "name": "aspire-ai",
  "title": "aspire-ai",
  "description": "Adversarial Student-Professor Internalized Reasoning Engine - Teaching AI to develop judgment, not just knowledge.",
  "version": "0.1.0",
  "license": "MIT",
  "datePublished": "2026-04-20",
  "dateModified": "2026-04-20",
  "codeRepository": "https://github.com/mcp-tool-shop-org/prototypes/tree/main/packages/aspire-ai",
  "author": [
    {
      "name": "mcp-tool-shop"
    }
  ],
  "keywords": [],
  "lifecycle": {
    "state": "dormant",
    "stateSince": "2026-04-08",
    "maturity": "prototype",
    "caretaker": null,
    "graduatedTo": null,
    "resurrectionNotes": null
  },
  "taxonomy": {
    "category": "ml-and-training",
    "domains": [],
    "tags": [
      "python",
      "cli",
      "mcp",
      "sdk"
    ]
  },
  "technical": {
    "kind": "library",
    "programmingLanguages": [
      "Python"
    ],
    "runtimes": [],
    "operatingSystems": [
      "any"
    ]
  },
  "health": {
    "lineCount": null,
    "lastCommitAt": null,
    "commitRecencyDays": null,
    "hasTests": null,
    "hasReadme": null,
    "hasLicense": null,
    "buildable": null
  },
  "lineage": {
    "sourceRepo": null,
    "consolidatedAt": "2026-04-08",
    "relatedSeeds": [],
    "deprecates": [],
    "successors": []
  },
  "sbom": {
    "format": "none",
    "url": null,
    "hash": null
  },
  "discovery": {
    "oneLiner": "Teaches AI to develop judgment through adversarial dialogue with internalized teacher models.",
    "whyItMatters": "Provides a novel approach to training AI by focusing on developing discernment rather than just memorizing answers."
  },
  "patterns": [
    {
      "name": "prompt-engineering",
      "category": "data-model",
      "summary": "Uses adversarial dialogue with teacher models to refine student model's reasoning and judgment."
    }
  ],
  "failureModes": [],
  "priorArt": [],
  "agentCapsule": {
    "insight": null,
    "excerpt": null
  },
  "ingest": {
    "method": "ollama-backfill",
    "model": "hermes3:8b",
    "confidence": 1,
    "manualReview": false,
    "ingestedAt": "2026-04-20T21:50:26.918Z"
  }
}
