{
  "$schema": "../../schemas/passport.schema.json",
  "conformsTo": [
    "codemeta:3.0",
    "ro-crate:1.1",
    "mcp-prototypes:passport:1"
  ],
  "id": "seed:tinytrainer:0.1.0",
  "swhid": null,
  "name": "tinytrainer",
  "title": "tinytrainer",
  "description": "Desktop training foundry + mobile personalization export pipeline.",
  "version": "0.1.0",
  "license": "MIT",
  "datePublished": "2026-04-20",
  "dateModified": "2026-04-20",
  "codeRepository": "https://github.com/mcp-tool-shop-org/prototypes/tree/main/packages/tinytrainer",
  "author": [
    {
      "name": "mcp-tool-shop"
    }
  ],
  "keywords": [],
  "lifecycle": {
    "state": "dormant",
    "stateSince": "2026-04-08",
    "maturity": "prototype",
    "caretaker": null,
    "graduatedTo": null,
    "resurrectionNotes": null
  },
  "taxonomy": {
    "category": "ml-and-training",
    "domains": [],
    "tags": [
      "python",
      "cli"
    ]
  },
  "technical": {
    "kind": "cli",
    "programmingLanguages": [
      "Python",
      "TypeScript",
      "JavaScript"
    ],
    "runtimes": [],
    "operatingSystems": [
      "any"
    ]
  },
  "health": {
    "lineCount": null,
    "lastCommitAt": null,
    "commitRecencyDays": null,
    "hasTests": null,
    "hasReadme": null,
    "hasLicense": null,
    "buildable": null
  },
  "lineage": {
    "sourceRepo": null,
    "consolidatedAt": "2026-04-08",
    "relatedSeeds": [],
    "deprecates": [],
    "successors": []
  },
  "sbom": {
    "format": "none",
    "url": null,
    "hash": null
  },
  "discovery": {
    "oneLiner": "Train tiny classifier heads on frozen sentence embeddings, then export to Core ML and ONNX for mobile deployment.",
    "whyItMatters": "Enables training compact models for mobile devices with the ability to personalize on-device."
  },
  "patterns": [
    {
      "name": "llm-integration",
      "category": "data-model",
      "summary": "Integrates frozen sentence embeddings from large language models as backbone features."
    }
  ],
  "failureModes": [],
  "priorArt": [],
  "agentCapsule": {
    "insight": null,
    "excerpt": null
  },
  "ingest": {
    "method": "ollama-backfill",
    "model": "hermes3:8b",
    "confidence": 0.7,
    "manualReview": true,
    "ingestedAt": "2026-04-20T21:59:07.050Z"
  }
}
